en	desc
Nyami Nyami	Zambezi River god of the Tonga\nand Lozi tribes of southern Africa.\n \nHe has the body of a snake and the\nhead of a fish or dragon. He is said to\nprotect people near the water and\nprovide them with food. He lived with\nhis wife, Kitapo, until the construction\nof the Kariba Dam, which separated\nthem. The local inhabitants were also\nforced to move to barren land. It is\nsaid that the great floods that\noccurred during the construction of\nthe dam were caused by the Nyami\nNyami, who was angered by these\nevents.
101	101
102	102
Yamata-no-Orochi	A giant snake with eight heads that\nthe hero Susano-o defeated to save\nKushinada-Hime.\n \nThe legendary sword\nAme-no-Murakumo-no-Tsurugi,\nalso known as the Sword of Kusanagi,\nis said to have emerged from its belly.
Naga Raja	The king of the Naga, a half-man,\nhalf-snake tribe in Hindu lore.\n \nThe dragon kings Nanda and\nTakshaka of Buddhist myth fall into\nthis royal category.
Yurlungur	In Oceanian folklore, he is a giant\ncopper python.\n \nA being that transcends good and\nevil, he governs the weather and is\nconsidered a god of the harvest.\nIt's said his body is long enough to\nreach the heavens. He is also called\nthe Rainbow Serpent because the\nwater in the well he calls home\nshines like a rainbow.
Naga	Half-snake, half-human, they are\ndivine beings in Hindu lore.\n \nWorshiped as bringers of fertility, they\nlive in the bottoms of lakes and seas,\nand enjoy singing and dancing\noutside of battle.
Nozuchi	Said to be the spirit of a serpent\nthat has lived in the mountains since\nancient times in the Nihon Shoki and\nis also said to govern the earth's\nveins.\n \nThe name Nozuchi comes from the\nancient Japanese word for \''god of\nthe fields.\'' It is said to live deep in\nthe mountains behind trees and in\nthickets. It has a large mouth at the\nend of its head, but no eyes or nose.\nIt is not evil, but rather violent all the\nsame. When it sees a human, it may\ntry to harm or even eat them.
Vouivre	A female dragon with bat wings,\neagle legs, and a viper tail. Sometimes\ndepicted as a beautiful female spirit.\n \nThe secret of Vouivre's power is a\ngarnet jewel on her forehead, which\nif lost or stolen, causes her to lose\nall her magical powers and forces\nher to obey the gem's owner. Some\nbelieve the jewel is not actually\nfound in the forehead, but actually \nrefers to her eyes.
109	109
110	110
Vasuki	A giant serpent of Hindu lore.\n \nIt is said that gods and demons used\nhis body to churn the chaotic sea\nof milk and create Amrita, or\nimmortality. Using Mt. Mandara as a\npole and his body wrapped around it\nas a rope, the gods and demons took\nturns pulling his body on either side,\nmoving Mt. Mandara around in the\nsea. The strain from this caused him\nto spew incredibly poisonous venom,\nwhich was then safely swallowed by\nShiva before it could ruin Amrita.
Seth	The Egyptian god of the desert,\nchaos, and evil.\n \nHe murdered his brother Osiris and\ntried to become chief god, but he was\nlater castrated by Osiris's son Horus.
Basilisk	A dark dragon from Northern Africa\nmarked by wings and a crested\ncrown.\n \nIts name means \''king of snakes,\''\nand both its breath and gaze are\nso toxic that they instantly kill any\nhuman or animal unfortunate enough\nto be subjected to them.
Aitvaras	A fairy in Lithuanian mythology.\n \nIndoors, it takes the form of a black\ncat or a rooster. Outdoors, it takes\nthe form of a small dragon or a snake\nwith a burning tail. The Aitvaras\nmakes the home it inhabits rich by\nstealing from its neighbors. It is said\nthat it typically demands an omelet\nas compensation and is difficult to\nchase away once it's settled into a\nhome. It can, however, be\nexterminated by shining it with the\nflame of a candle purified by the\nchurch.
Hydra	One of the monsters in Greek\nmythology. It is usually depicted as\nhaving nine heads, but some say that\nit has as many as 100.\n \nIts father is Typhon, Giant of the Wind,\nand its mother is Echidna, Goddess\nof the Snake. The Hydra has\nincredible regenerative power; so\nmuch so that when one of its heads\nis cut off, two more will sprout from\nthe wound. It is also extremely\nvenomous, and simply inhaling its\nbreath is enough to kill. The slaying\nof Hydra is listed as one of the 12\ngreat Labors of Hercules.
Fafnir	An evil dragon of Norse lore that was\nvanquished by the hero Siegfried.\n \nAccording to the Völsunga saga, it\nwas extremely venomous, had legs\nlike snakes, and shook the ground\nwith every step.
Zhu Tun She	A monstrous snake-like beast sighted\nin China during the Song dynasty.\n \nIt appeared before soldiers-in-training\nand tried to swallow humans, but was\ndefeated by a soldier with sorcerous\npowers. A bizarre, hairy quadruped\nabout three feet long, it emerges from\na bamboo grove with a pig-like squeal.\nBecause its features defy taxonomic\nclassification, it is highly suspected\nto be a creature wholly unknown.
Samael	An enigmatic angel whose name bears\nthe unusual meaning \''poison of God\''\nand who is commonly depicted as a\nwinged serpent.\n \nThough an angel, he is often referred\nto as the leader of daemons. It's been\nsuggested that he's a fallen angel, but\nseveral descriptions in the Bible and\nother sources refute this.
Barong	Said to live in the forests of Bali,\nit was a great mythical beast whom\nthe people sanctified and made their\nguardian.\n \nNow a symbol of good, it is fated\nto fight Rangda, the avatar of evil,\nfor all eternity.
Anubis	The jackal-headed god of the dead\nand embalming from Egyptian myth.\n \nHe weighs the hearts of the dead to\ndetermine their final destination. He is\nalso said to govern the technique of\nmummification.
Makami	A divine beast in Japanese\nmythology.\n \nIt has been said to ward off evil and\ndisasters, especially thefts and fire,\nand is commonly drawn on \''ema,\''\na type of Japanese amulet.\nHowever, despite being known\nprimarily for protection, it has\nalso been rumored to eat people.
Xiezhai	A sacred beast resembling a sheep in\nChinese legend.\n \nIts eyes are said to have the power\nto see through any lie. Often\nappearing in the human world, it is\nsaid to punish the wicked with the\npower of its sharp horn.
123	123
124	124
125	125
Baihu	One of the Ssu-Ling, celestial\ncreatures in Chinese mythology.\n \nIt represents the west, the season of\nautumn, and the element of metal. It\nis believed to be the king of all\nbeasts.
Chimera	A monster that is part lion, part goat,\nand part snake.\n \nOriginally a symbol representing\nthe seasons, it became a violent\nmonster when adopted into Greek\nmythology. Its father is Typhon\nand its mother Echidna.
Cironnup	\''Fox\'' in the Ainu language. Though\n\''sumari\'' is another word for fox,\n\''chironnupu\'' refers to \''those who\nwe kill,\'' and is said to be the general\nword for small-to-medium-sized\nanimals.\n \nIn Ainu culture, it is also a divine\nbeast that alerts people to\nforthcoming disasters by howling\nloudly from the mountains.
Shiisaa	A holy beast said to protect houses\nfrom evil and grant them fortune.\n \nThough it may look similar to Shinto\nguardian dogs, it is actually modeled\nafter a lion. There are many stories\nabout it in Ryukyu lore.
Senri	A yokai said to be born from the\nincarnation of a long-lived wildcat. It\ndisguises itself as a beautiful woman\nand collects vitality from human\nmen.\n \nIt is said to be the highest rank\npossible for a beast's demonic\nincarnation, similar to nekomata.\nSome believe all beast-demons\ngather spirits in the hopes of\nbecoming a Senri themselves.
Unicorn	A white horse of Scottish legend,\nfeaturing a spiral horn on its forehead.\nThis horn is said to make a panacea\nfor all manner of ailments, but it will\nonly open its heart to the purest of\nmaidens, allowing only them to\ntouch its body.
132	132
133	133
Cerberus	The guardian hound of Hades in\nGreek lore.\n \nIt traditionally has three heads and\na snake's tail. It was born from\nTyphon, the Giant of Wind, and\nEchidna, the Mother of Monsters.\nIt is also the older brother of Orthrus.
Orthrus	The two-headed dog who protected\nthe Titan Geryon's red cattle in Greek\nlore.\n \nDespite his skill as a guard, Hercules\nkilled him in one blow while\nperforming one of his 12 great labors.
Loup-garou	A type of werewolf originating in\nFrance. It appears human during the\nday but transforms into its beastly\nform at night, when it has been\nknown to viciously attack humans.\n \nThey are said to have once been\nordinary human beings. However,\nupon turning into a loup-garou, one\ncannot regain their humanity ever\nagain.
Nekomata	Incarnations of long-living cats in\nJapanese mythology.\n \nThey can speak to humans and, \ndepending on their power, can do\nvarious things. Some can turn into \nhumans, while others can have the\ndead do their bidding.
Inugami	Spirits of dogs said to possess\nhumans in Japanese folklore.\n \nThose possessed enter a state of\n\''inu-tsuki\'' and go crazy. Onmyoji,\nor Japanese sorcerers, summon\nthem to do their will.\nIt is often used as a curse to\nhumiliate people, and it is said that\nthis spirit is created by ending the\nlife of a living dog in accordance\nwith the art.
Orobas	One of the 72 demons\nof the \''Ars Goetia.\''\n \nHe is said to appear as a human with\nthe head of a horse. He answers all\nquestions concerning past, present,\nand future, and is both liked and\nrespected by sorcerers. According\nto legend, he was often summoned\nby sorcerers seeking to see through\nlies or predict the future.
Cait Sith	A fae beast from the Scottish\nhighlands whose kingdoms can be\nfound in tree hollows or abandoned\nhouses.\n \nDog-sized, they have white tufts of\nhair on their chest, green, intelligent\neyes, and are even capable of\nunderstanding the human language.\nThough they usually stick to their\nterritory, some have been known to\nlive with humans as normal black\ncats. They are generally peaceful,\nbut should a human treat one poorly,\nthey will forcibly take that human to\ntheir kingdom.
Dormarth	A canine demon of Celtic mythology.\n \nCommanded by Gwyn, King of the\nAfterlife, she is said to be a hound\nwith a red nose visible through even\nthe mountain mist. The meaning of\nher name is uncertain and subject\nto much speculation, but the most\ncommon theory is \''death's door,\''\nand she is thought to be the\ngatekeeper of the afterlife\nunder Gwyn's reign.
Glasya-Labolas	One of the 72 demons of the\n\''Ars Goetia,\'' sometimes referred\nto as Caacrinolaas.\n \nHis form is described as a dog with\ngriffin-like wings, and he can impart\ninstant knowledge in all arts and\nsciences. It is also said that he is\nthe author of bloodshed and murder,\nexcels at predicting the future, and\ncan make people invisible.\nSome accounts suggest the demon\nNebiros uses him as a mount.
143	143
Bugs	A type of goblin from Welsh folklore\nthat eats children who don't listen to\ntheir parents.\n \nThey are said to look like humans \ncovered head to toe with hair, and\nare recognized as an iconic monster\nthat appears at nighttime.\nThey are often spoken of by mothers\nwishing to discipline their children as\nnoted in the popular phrase, \''For\nnaughty kids who disobey, the Bugs\nwill come and surely prey.\''
Nue	A legendary monster in Japanese\nmythology. It has the head of a\nmonkey, the body of a tanuki, the\narms and legs of a tiger, and the tail\nof a snake.\n \nDue to its bizarre appearance, the\nterm \''Nue\'' is sometimes used\nto describe a person of unknown\norigins. According to \''The Tale of\nthe Heike,\'' the Nue would come\nto the emperor's palace every night\nfrom 2 to 2:30 A.M., shrouded in\na dark cloud, where it would howl\nin a horrific and terrifying manner.\nHowever, the warrior Minamoto no\nYorimasa eventually shot it down\nwith his bow.
Bicorn	An evil creature that looks like a horse\nwith two curved horns.\n \nIt is said to be the opposite of\na Chichevache, but theory speculates\nthat it is actually a mistranslation of\nRe'em, a two-horned beast that\nappears in the Old Testament.
Mothman	A cryptid sighted in West Virginia from\nthe 1960s to the 1980s.\n \nIt has red, shining eyes and was\nknown for the finlike appendages\non both sides of its body. It has been\nsaid to walk on two feet and fly\nwithout moving these appendages.\nIt has a keen sense for blood which\nallows it to easily track its prey.\nEyewitnesses say that a UFO was\nsighted when Mothman appeared,\nso many believe that it is actually\nan alien.
Fenrir	A monstrous wolf of Norse mythology.\nSon of the evil god Loki, he is said to\nswallow the god Odin at the world's\nend.\n \nHe is bound with the magic rope\nGleipnir, but it is said that he\nwill be released from this bondage\non the apocalyptic day of Ragnarok\nand stand against the gods.
Peallaidh	A half-human, half-beast Scottish\nfairy. Said to prefer to live near\nwater, such as rivers, lakes, and\nshores.\n \nA kind of spirit called \''ùruisg,\'' it is\ndescribed as a hairy human male\nfigure with the upper body of a man,\nthe legs of a deer and the hooves of\na goat. When lonely, they are said to\nrun after travelers and others all night\nin search of human companionship\nAlthough basically harmless, they\nare said to be the most malevolent\nof the ùruisg fairies and dangerous\nto approach.
150	150
151	151
Hayataro	The spirit of a monster-busting dog\nthat used to live at Kozen-ji.\n \nLong ago, the villagers of Mitsuke\nwould offer one of their own girls\nto a giant monkey yokai to prevent it\nfrom ravaging the fields. A monk\npassing by learned of this, and\nthat the yokai greatly feared Hayataro.\nThe monk then rushed off and found \nHayataro at Kozen-ji. Hayataro was\noffered in place of a village girl, where\nhe then defeated the yokai, but was\nmortally wounded in the epic battle.\nThe loyal dog traveled back to\nKozen-ji, where he died shortly\nafter reuniting with his master.
153	153
154	154
Flaemis	A fire elemental; one of the four\nelements in energy form.\n \nIt is said to be composed of both\ndry and heat essences.\nThe ancient Greek concepts of\nthe four basic elements significantly\ninfluenced early astrology.
Aquans	A water elemental; one of the four\nelements in energy form.\n \nAccording to Aristotle, it is composed \nof both moist and cold essences.
Aeros	A wind elemental; one of the four\nelements in energy form.\n \nIt is said to be a fusion of moist \nand heat essences, forming\nthe basis for an exponential energy\nincrease.
Erthys	An earth elemental; one of the four\nelements in energy form.\n \nIt is said to be composed of dry\nand cold essences, which are\nknown to be the basic components\nof destruction.
159	159
160	160
161	161
162	162
Saki Mitama	One of the souls in Shintoism's\none spirit, four souls theory that\nbrings great bounty from the hunt.\n \nIt is said to hold the power of love,\nprofit, and growth, and can\neven create new paths.
Kushi Mitama	One of the souls in Shintoism's\none spirit, four souls theory that\nbrings about good omens.\n \nIt is said to hold the power of\nwisdom, observation, and skill,\nand can also mend fractured paths.
Nigi Mitama	One of the souls in Shintoism's\none spirit, four souls theory that\nworks peacefully to help maintain\na calm mind.\n \nIt is said to hold the power of\nfamiliarity, calmness, and sociability,\nand can also lead one in a\npositive direction.
Ara Mitama	One of the souls in Shintoism's\none spirit, four souls theory\nthat brings about wild and\nferocious power.\n \nIt is said to hold the power of\ncourage, growth, and endeavors,\nthough it can potentially lead one\nin a negative direction.
167	167
168	168
169	169
170	170
Black Ooze	An amoeba-like monster that attacks\nand eats people.\n \nSupposedly, it is actually a demon\nthat failed to take form and now\nroams in search of Magatsuhi.\nIt is said that when a Slime's ability\nto absorb Magatsuhi goes out\nof control, it transforms into\na Black Ooze.
Legion	A demon or horde of demons quoted\nas saying, \''For we are many\'' in the\nNew Testament.\n \nThe name comes from the Roman\nmilitary term for an army unit of\n3,000 to 6,000 men.
Slime	A gel-like monster. It is said to be the\nbyproduct of a failed summoning.\n \nDevoid of its original powers, it is\ntrapped in an incomplete gel form.\nThere are several theories of when the\nslime first was recorded as a monster.\nThey tend to collect shiny objects.
Mad Gasser	A mysterious figure that spreads an\nunknown poisonous gas around.\n \nHe wears all black and is said to be a\ntall man. The gas he uses has a sweet\nsmell, but inhaling it will cause intense\nheadaches and vomiting. He returns\nwhen people begin to forget his\nexistence, though he is rarely sighted.
Turbo Granny	The ghost of an old lady who runs\non all fours at blazing speeds near\nMt. Rokko.\n \nShould you manage to catch a\nglimpse of her back as she races by,\nyou will likely see a piece of paper\nposted on her back that reads\n\''Turbo.\'' She is not a dangerous\nghost, but her love for speed is\ninsatiable. Similar ghosts include the\n\''Dash Hag\'' of the Shuto Expressway\nand the \''100 km/h Granny\'' of\nHokkaido.
176	176
177	177
Shiva	The great god who governs the\ndestruction and creation of the world.\nHe is the most worshiped god in\nHinduism alongside Vishnu.\n \nIt is said that he purifies the world\nthrough destruction only to rebuild it\nanew, and though he casts terrifying\ndestruction against the demons, he\nalso blesses his followers. Shiva\nhas been depicted in many ways, but \nthe most common is for him to have\nfour hands, one face, and three eyes.\nHe wields a trishula, or trident, and\nhis third eye is said to emit a ray of\nlight that destroys all it touches.
Mot	The Canaanite god of death.\n \nEvery year he attempts to kill Baal,\nthe god of fertility, only to see him\nraised from the dead with the help\nof Baal's sister, Anat.
Zaou-Gongen	Repeller of evil found at Kinpusen\nby En-no-Ozunu.\n \nBelieved to be a fusion of Buddha,\nGuanyin, and Maitreya, he is a god\nwho originated from Japan, rather\nthan the Buddhavacana.
Asura	A violent group of demons in Hindu\nlore.\n \nThey were very powerful and\ncaused the gods great trouble. They\nare a fiercely strict group and attack\nanyone who runs counter to their\nideals. They were originally gods of\nlight worshiped in Persia. The\nZoroastrian god Ahura Mazda was\none of them.
Chernobog	The god of night, evil, and death in\nSlavic lore. His name means \''black\ngod.\''\n \nLike many other gods of the dead,\nhe is said to live below the earth.\nHis counterpart is Belobog,\nthe \''white god.\'' Despite being feared,\nhe was also worshiped. The curse,\n\''May the black god end you,\'' is still\nused in Ukraine to this day.
Dionysus	The Greek god of wine and theater.\nHe had two births.\n \nMyth tells that Zeus took the\npremature Dionysus from his dying\nmother, Semele, and allowed him\nto mature inside his thigh\nso that the underdeveloped god\nmight have a proper birth.
184	184
185	185
186	186
187	187
Danu	The mother goddess of Celtic\nmythology. She is the mother of the\nTuatha Dé Danann, a race of gods,\nand also the world itself, having given\nbirth to all life.\n \nDanu's large body is said to be\nlying down on earth to this day.\nThe Munster region in Ireland, which\nis said to be rather spiritual, is known\nto be especially blessed by her.
Inanna	The Sumerian goddess of fertility.\n \nHer name means \''Lady of Heaven,\''\nand she is often viewed as one and\nthe same with Aphrodite, Ishtar, and\nVenus. She is also a goddess of\nwarfare, and it is said that even male\ngods feared her great power.
Kali	The Black One, a symbol of death\nand destruction.\n \nShe is said to be another face of\nParvati, Shiva's consort. Wearing a\nnecklace of human heads, she wields\nnumerous bloody swords, one for\neach of her many arms. It is said that\nwhen Durga, another form of Parvati,\nwas fighting the Asuras, she\nsummoned Kali and defeated\nthe Asura army in an instant.
Cybele	Mother goddess of nature.\n \nA temple for her was created atop a\nmountain in Phrygia, now modern-\nday Turkey, where she was\nworshiped. She ruled over beasts and\nwas said to be served by lions. She\nlater became a goddess passionately\nworshiped in Rome.
Skadi	A giantess called the \''snowshoe\ngoddess,\'' she is the embodiment\nof winter.\n \nHer name means \''shadow,\'' said\nto refer to the shadow of where\nthe gods will fall on Ragnarok.\nIn Celtic mythology, she is the\ngoddess of darkness, and is\nsometimes identified with the\ngoddess Scathach. In Norse\nMythology, she is the wife of\nNjörðr, and the goddess of winter\nand mountains.
Isis	The mother goddess of Egypt.\nShe is wife and sister to Osiris,\ngod of the underworld.\n \nKnown for her powerful magic,\nshe could perform miracles such as\nraising her husband from the dead.\nAs the patron goddess of the dead,\nher image can be found at many\nburial sites.
Kikuri-Hime	The goddess of Shirayama, also\ncalled Shirayama-Hime, and the\ndeification of a maiden who relayed\nIzanami's words.\n \nShe once mediated between Izanagi\nand Izanami during their confrontation\nin Yomi, the land of the dead. Since\nshe is the goddess of love and\nmarriage, she was thought to have\nbeen named for \''kukuri,\'' meaning\n\''to bring people together.\''
Hariti	A Buddhist goddess also known\nas Kishimojin.\n \nShe was originally an evil devil who\nate children, but when Buddha hid\nthe most beloved of her 500 children,\nshe was stricken with sorrow. Having\nbeen taught the pain of losing a child,\nshe then became a good god and\nstarted eating pomegranates instead\nof children.
196_ATHTART	196_ATHTART
Nuwa A	A goddess that appears in Chinese\nmythology.\n \nRecognized as one of three\nsovereigns, she is said to have the\nhead of a human and body of a\nserpent. As a demigod, she is also\nknown to be responsible for the\ncreation of humanity, having created\nhumans from mud. Legend says that\nwhen one of the four pillars said to\nhold up the world broke, she\nrepaired it. Fuxi, also of the three\nsovereigns, is typically labeled as\neither her brother or her husband\ndepending on what version of her\nstory is told.\n \nShe takes this serpentine form when\nunleashing a portion of her power,\nthough she is capable of far more.
Alilat	An Arabian mother goddess,\nalso known as Al-Lat.\n \nInvoked for a variety of purposes,\nfrom good weather and protection\nto vengeance and pestilence.
199	199
Thor	The Norse god of thunder and fertility\nwhose strength is incomparable.\n \nHe is a heroic and honest god\nworshiped mainly by farmers and\nis primarily known for defeating\nthe giants. He wields Mjolnir,\na hammer that returns to its owner\nafter being thrown. He and\nthe World Serpent, Jormungandr,\nare fated to kill each other at\nRagnarok.
Futsunushi	The Nihonshoki sword deity who\npacified Ashihara-no-Nakatsukuni.\n \nHis name comes from \''futsu,\'' the\nfashion in which things are cut, and\n\''nushi,\'' a term meaning, \''nature as a\ngod.\''
Attis	A Phrygian god who symbolizes life,\ndeath, and revival.\n \nHe rejected Cybele's love and was\ndriven mad, dying shortly after\ncastrating himself. Cybele then\nresurrected him.
Bishamonten	The strongest of the Four Heavenly\nKings, also known as Tamonten, and\nin Buddhist mythology, Vaishravana.\n \nHe protects the North and is\nrecognized as the god of war.\nSimilarly to his fellow kings, he is\noften depicted as a fierce warrior clad\nin armor and wielding a great spear.\nBishamonten is also well known as a\nbringer of fortune, being one of the\nShichi Fukujin, the seven gods of\nfortune.
Jikokuten	Jikokuten, protector of the East, is\none of the Four Heavenly Kings in\nBuddhist mythology.\n \nHe is also known as Dhritarashtra,\nand similarly to his fellow kings,\nis often depicted as a fierce warrior\nclad in armor and wielding a sword.\nAs his name suggests, it is said that\nhe bestows serenity upon a country.
Koumokuten	Koumokuten, protector of the West,\nis one of the Four Heavenly Kings of\nBuddhist mythology.\n \nSimilarly to his fellow kings, he is\noften depicted as a fierce warrior\nclad in armor and wielding a trident.\nHe is also known as Virupaksha and\nis said to keep a close eye on the\nworld with his sharp gaze, preaching\nto the people all the while.
Zouchouten	Zouchouten, protector of the South,\nis one of the Four Heavenly Kings in\nBuddhist mythology.\n \nSimilarly to his fellow kings, he is\noften depicted as a fierce warrior\nclad in armor and wielding a long\nsword, though he is sometimes\nshown wielding a trident instead.\nAlso known as Virudhaka, he is god\nof the five grains.
207	207
208	208
209	209
210	210
Arahabaki	A major deity in ancient Japanese\nmythology. Clay dolls were often\nsculpted in its image.\n \nHowever, because this god was\nknown to be worshiped by a rebel,\nthe dolls later came to be considered\nsymbols of defiance.
Oyamatsumi	One of the Kunitsukami in Japanese\nmythology. He is the grandfather of\nSusano-o's wife, Kushinada-Hime.\n \nHe is known as the god of the\nmountains but is also considered\nto be the god of water and rice fields\nbecause he ruled over water sources\nand harvests.
Kushinada-Hime	Kushinada-Hime is a goddess in\nJapanese mythology.\n \nWhen she was human, she was\nsaved from the eight-headed serpent\nYamato-no-Orochi by the storm god\nSusano-o, whom she later wedded.
Sukuna-Hikona	One of the gods of Japanese lore.\nSon of Kamimusubi, he was so small\nhe fell through her fingers at birth.\n \nThough he would normally be\ncounted among the Amatsukami, he\nbecame blood-brothers with\nOkuninushi and is now considered a\nKunitsukami. After building Japan\nwith Okuninushi, he is said to have\nreturned to Tokoyo no Kuni, the land\nof eternity.
