en	desc
Okuninushi	A Kunitsu deity of Japanese\nmythology that governs agriculture\nand medicine.\n \nSaid to have built the country of\nIzumo with Susano-o's daughter\nSuseri-Hime. He is a peaceful god\nwho prefers not to fight.
Take-Minakata	A Japanese god of war, hunting, and\nfertility.\n \nHe fought Take-Mikazuchi for control\nof Japan and lost. He escaped to\nSuwa but has been prohibited from\nleaving ever since.
217	217
218	218
219	219
220	220
Ganesha	The elephant-headed god in Hindu\nmythology.\n \nHe was originally created\nout of dirt by Pavarti to prevent\nanyone from watching her bathe. It is\nsaid that Shiva knocked his head off\nbut later replaced it with an\nelephant's head.
Siegfried	The name of the hero in the epic\nGerman poem, the Nibelungenlied,\noften seen as the same as Sigurd of\nNorse folklore.\n \nHe was married to Kriemhild, the\nprincess of Burgundy, and is said to\nhave become wrapped up in a feud\nbetween her and Brunhilde of\nAustrasia, resulting in many attempts\non his life. The dragon Fafnir's blood\nmade him invincible, but a single leaf\non his back resulted in a weak spot,\nwhich was later exploited by the\ntreacherous Hagen.
Valkyrie	Daughters of Odin from Norse\nmythology.\n \nTheir name means \''choosers of\nthe slain.\'' Armed with shining\narmor and spears, they look for\nbrave warriors to take to Valhalla,\nso that they may fight in Ragnarok.
Yoshitsune	A Japanese general of the Genpei\nWar near the end of the Heian era\nand start of the Kamakura era.\n \nAlso known as Ushiwakamaru, he is\nsaid to have learned the art of war\nfrom the Mt. Kurama Tengu. On\njoining his half-brother Yoritomo's\narmy, he defeated the Taira one by\none, finishing them off at the battle\nof Dan-no-ura. He was later pursued\nby Yoritomo's army, only to kill\nhimself at Koromogawa.
Neko Shogun	The god of prophecy in Taoist religion.\n \nIt is said to have the head of a cat and\nthe body of a human, and its shrine\nwas located in Annam, which is\npresent-day Vietnam. The shrine was\nmeant for Mao Shangshu, a 14-15th\ncentury general who conquered\nVietnam. However, because the name\n\''Mao\'' is similar to the Chinese word\nfor cat, the temple was effectively\nmisnamed, and he was reborn as a\ndifferent god. It should also be noted\nthat there is a similar story about the\ngod of sailing known as \''Tetsu Neko\nShogun.\''
Nezha Taizi	A protection deity of Chinese lore.\nSometimes said to take the form of\nan ageless young man, he was\ngranted his trusty weapon Qiankun\nQuan (Universe Ring) and his\ntrademark Hun Tian Ling (Red\nArmillary Sash) upon birth. He later\ncommitted suicide as atonement for\nkilling the Dragon King, but was\nbrought back to life with lotus roots.\nIn \''Journey to the West,\'' he fought\nan intense battle with Sun Wukong.
Masakado	A general who rebelled against the\nImperial Court in the mid-Heian\nperiod: Taira no Masakado.\n \nHe succeeded in ruling Kanto and\ndeclared himself emperor, but was\nlater defeated by Fujiwara no Hidesato\nand Taira no Sadamori. After death,\nhe was enshrined as a vengeful spirit,\nbut was later viewed as a hero and\nbecame revered as a guardian deity\nof the Kanto region, where he has\nremained to this day.
228	228
229	229
230	230_LAHMU
Mada	A giant Asura in Hinduism whose\nname means \''the intoxicator.\''\n \nIt is said that the sage Chyavana\ncreated it from fire. Mada has the\npower to swallow its enemies, and\neven the deity Indra has been said to\nsurrender to its power.
Girimekhala	A giant elephant monster of\nSri Lankan mythology.\n \nIt is typically portrayed as being\nridden by Mara, the Evil One.\nWhoever looks into its evil eye is said\nto be met with great misfortune.
Pazuzu	A demon from Sumerian civilization,\nhe governs the southwestern wind.\n \nHe has the face of a lion, the body\nof a human, the wings of a bird,\nthe talons of an eagle, the tail of\na scorpion, and a curved horn\nprotruding from his forehead.\nIt is said that the wind he blew\nfrom the Persian Gulf spread\ndisease throughout the land.
Mishaguji	An indigenous god of the Shinano\nregion from before the forces of\nYamato occupied the land.\n \nSaid to be born from the belief that\ndivine spirits dwelled in rocks and\nstones.
Baphomet	An idol commonly worshiped\nby the Knights Templar.\n \nA demon with the head of a goat,\nthis figure later became the idol of\nworship for witches as well.
Lahmu	A god that appears in Babylonian\nmythology.\n \nBorn from Apsu and Tiamat, he and\nhis sister, Lahamu, gave birth to\nAnshar and Kishar. Lahmu is at times\ndepicted as a large serpent but has\nalso been illustrated as a man wearing\na red sash with six curls in his hair.\nRegardless, he is always shown\nalongside Lahamu, and it is thought\nthat together they represent the silt\nin the sea where Apsu's fresh water\nand Tiamat's sea water mix.
Saturnus	A fertility god of Roman mythology,\nassociated with the primordial earth.\nHe is commonly identified with the\nGreek god Cronus. Often referred to\nas \''Black Sun\'' by Chaldean\nastronomers, linked to the low\nposition of the sun around the time\nof the winter solstice. Also known as\nthe \''Night Sun\'' and also the \''King\nof Death\'' living in the depths\nof the underworld. It is said that\npeople prayed to Saturnus, the\nwinter sun, to call for a new spring,\nand that custom became what we\nnow know as Christmas.
Tzitzimitl	Aztec goddesses of night and fear.\nThey constantly attack the sun and\ncause solar eclipses. They demand a\nsacrifice once every 52 years.
239	239
Abdiel	A high-ranking angel wholly devoted\nto carrying out God's will. The name\nAbdiel carries the meaning of \''slave\nto God,\'' which supposedly originates\nfrom the Arabic word for \''slave.\''\n \nOf all the angels who followed Lucifer,\nAbdiel was the only one to reject the\ntemptation to rebel against God and\ninstead received God's praises for\nreturning to His side. Abdiel then led\nthe angels to fight against Lucifer.
Metatron	One of the most important angels in\nthe hierarchy yet the most\nmysterious.\n \nHe is the scribe and advocate\nof heaven.
Michael	One of the four major angels, his\nname means \''He who is like God.\''\n \nHe stands at the top of the angel\nhierarchy and carries a divine\narmament known to shatter any\nblade.
Gabriel	One of the four major angels. The\nname Gabriel means \''God is my\nstrength.\''\n \nActing as a messenger for God,\nGabriel is the one who informed\nthe virgin Mary of her pregnancy.\nThough often depicted with a feminine\nface, there are various interpretations\nsuggesting that Gabriel is not\nandrogynous but is in fact a woman.
Sraosha	In Zoroastrian lore, Sraosha's duty is\nto listen to humanity's cry for Ahura\nMazda.\n \nIt is also known to descend\nafter sunset to vanquish evil, and its\nname literally means \''observance.\''
Raphael	One of the four major angels. His\nname means \''healer.\''\n \nHe explains the history of the fallen\nangels and the creation of Adam\nand Eve.
Sandalphon	The twin brother of Metatron.\n \nAn influential angel in Jewish\nmythology, he governs the songs\nof heaven, and his colossal size has\nled many to believe that it would take\na human being 500 years to reach his\nhead.
Uriel	One of the four major angels.\n \nHis name means \''Flame of God,\''\nand he possesses knowledge of\nall celestial phenomena. He is\nalso the first angel Satan met\nafter falling to Earth.
Camael	The angel of God in Jewish\nmythology. He rules over the angels\nknown as the Powers, and his name\nCamael means \''one who sees God.\''\n \nHe is also the commander of the\nangels of destruction, punishment,\nand death in addition to being the\nruler of Mars.
Melchizedek	A Christian Gnostic angel said to be\nthe \''savior of angels.\''\n \nIn the Bible, he is referred to as\n\''Melchizedek, king of Salem.\'' One\naccount names his mother as the\nvirgin Sofonim. He is associated\nwith bread and wine, and known\nas the head of the angels of\npeace.
Mastema	An angel who persecutes evil in\nHebrew lore. His role is to deliver\npunishment on behalf of God.\n \nHe is said to be permitted by God\nto tempt humans and test their faith,\nand even has demons as his servants,\nat the behest of God. The Zadokite\nFragments and the Dead Sea Scrolls\ndescribe him as the angel of woe,\nthe father of all evil, and a flatterer\nof God.
Armaiti	An archangel worshiped in\nZoroastrianism, and one of the\nAmesha Spenta.\n \nShe is the daughter of the head god\nAhura Mazda, and an angel who\noversees the earth and provides\npasture for livestock. Armaiti is\nroughly translated as \''devotion,\''\nand she is the personification of piety.\nIt is said that she is heartbroken when\nsinful humans walk on her path, and\nrejoices when those who follow the\nlaws of heaven feed their livestock\nand birth pious and virtuous children.
252	252
253	253
Throne	The third of the nine orders of angels.\nTheir Hebrew name, Ophan, carries\nthe meaning of \''wheel.\''\n \nThey are the highest ranking angels\nto carry a material body and are\ntasked with carrying the seat of God.
Dominion	The fourth of the nine orders of\nangels. Their name carries the\nmeaning of \''governance,\'' and it is\ntheir duty to oversee the other angels.\n \nIt is said that their work is the\nembodiment of God's will, and that\nthey wish for this governance to\nspread throughout the cosmos.
Power	The sixth of the nine orders of angels.\nTheir name carries the meaning of\n\''power of God.\''\n \nAs their duty is to protect the souls of\nhumans, they are constantly on patrol\nto guard against demon attacks.\nIt is said that more than a few fall\nbecause they are in a position to be\neasily tempted by demons, and many\nnow-fallen angels are said to have\noriginally been Powers themselves.
Principality	The seventh of the nine orders\nof angels.\n \nThey are charged with overseeing the\nwelfare of countries and civilizations.
Archangel	Eighth of the nine orders of angels.\n \nThey are responsible for ministering\nto humans and delivering messages.\nAs warriors of the heavens, they lead\nthe armies of heaven against the\nforces of darkness. Archangels were\nonce considered the highest rank of\nangels, but were placed eighth in the\nmedieval angelic hierarchy.
Angel	Ninth of the nine orders of angels.\n \nThey are closest in nature to humans.\nThey watch over individuals and\noffer warning to those who stray\nfrom the path.
Cherub	A senior angel in the angelic\nhierarchy, ranked second in the\norder of angels.\n \nThey are represented by four wings\nand four faces, and carry the throne\nof God or drive His chariot. In the\nBible, they are known as the\ngatekeepers of the Garden of Eden,\nwhere they are said to guard the\ntree of life with flaming swords.
261	261
262	262
263	263
Abdiel A	A high-ranking angel wholly devoted\nto carrying out God's will. The name\nAbdiel carries the meaning of \''slave\nto God,\'' which supposedly originates\nfrom the Arabic word for \''slave.\''\n \nOf the angels who followed Lucifer,\nAbdiel was the only one to reject the\ntemptation to rebel against God,\nand instead received God's praises\nfor returning to His side.\n \nAs God's order threatened to crumble,\nAbdiel took this form after resolving to\nprotect that order, and fell to darkness\nto obtain power greater than that of\nthe angels.
Adramelech	Chancellor of Hell and supervisor\nof Satan's wardrobe. He has the body\nof a mule, though he may also\nsometimes appear as a peacock.\n \nHe was worshiped by the Assyrians,\nwho occasionally offered him\nchildren as sacrifice.
Flauros	One of the 72 demons\nof the \''Ars Goetia.\''\n \nHe appears as a leopard and can see\ninto both the past and the future.\nHe can also control fire, which he\nuses to burn his adversaries to death.
Nebiros	The general of Hell. He keeps watch\nover other demons.\n \nAs one of Hell's greatest\nnecromancers, he can control\nsouls and corpses.
Berith	One of the 72 demons\nof the \''Ars Goetia.\''\n \nKnown as the Duke of Hell,\nhe rides a gigantic horse and\nburns those without manners.
Ose	One of the 72 demons\nof the \''Ars Goetia.\''\n \nAppearing as half-man and half-beast,\nit is said that he can change his form\naccording to the desires of the one\nwho summons him, though not for\nvery long.
Eligor	One of the 72 demons\nof the \''Ars Goetia.\''\n \nHe takes the appearance of a knight\nand has the power to see things to\ncome. He also possesses great\nknowledge of many wars.
Forneus	One of the 72 demons\nof the \''Ars Goetia.\''\n \nHe appears as a great sea monster\nand is skilled in many languages in\naddition to being a master of rhetoric.
Andras	One of the 72 demons\nof the \''Ars Goetia.\''\n \nThe great Marquis of Hell, he appears\nwhere there is battle to stoke the\nhatred within soldiers. He helps\ndefeat the enemies of those who\nsummon him.
Decarabia	One of the 72 demons\nof the \''Ars Goetia.\''\n \nHe comes in the shape of a star\nand has vast knowledge of herbs\nand jewels. He can also control\nbirds at will.
Halphas	One of the 72 demons\nof the \''Ars Goetia.\''\n \nHe is called the Count of Death\nand Destruction, and appears as a\njet-black dove with blood-red eyes.\nHe is a craftsman and builds towers\nfull of weapons.
Azazel	A leader of the Grigori, a group of\nangels who descended to earth to\neducate humans. He is said to have\ncommitted acts of defiance against\nGod, such as being attracted to\nbeautiful human daughters on earth\nand taking them as wives, and giving\nhumans various truths of forbidden\nknowledge. Azazel imparted\nknowledge of armors, ornaments,\nand makeup, teaching men to fight\nand struggle and women to dress up\nand seduce men.
276	276
277	277
Garuda	A divine bird-man in Hindu mythology.\n \nHe hunts Nagas as a result of a\ndispute between the two creatures'\nmothers. According to legend, he\nonce fought with the gods, and was\neven granted immortality in exchange\nfor becoming Vishnu's carrier.
Zhuque	One of the Ssu-Ling, celestial\ncreatures in Chinese mythology.\n \nIt represents the south, the season of\nsummer, and the element of fire. It is\nsaid to resemble a quail in\nappearance and have a beautiful\nchirping voice.
Yatagarasu	A divine creature in Japanese\nmythology, they are three-legged\nravens that the goddess Amaterasu\nsent to help humans.\n \nIt is said that they helped Emperor\nJinmu claim victory, and, despite\ntheir divine standing, those who are\nunworthy have been known to go mad\nafter looking them directly in the eye.
Jatayu	The Hindu king of birds.\n \nIn the Ramayana, he fought bravely\nagainst Ravana in an attempt to save\nSita, the wife of Rama, the seventh\navatar of Vishnu. However, he was\nunfortunately defeated.
Feng Huang	A legendary bird in East Asia, said to\nappear only in times of peace. It is\nthe ruler of all birds. When it dies,\nbirds across the land chirp with\nsadness.
Thunderbird	A revered bird of Native American\nmythology said to live atop\ncloud-shrouded peaks.\n \nIt resembles an eagle, and its\nwingbeats create mighty\nthunderclaps. Some legends say its\neyes can unleash lightning, and other\naccounts say it can carry an entire\nlake on its back or even swallow an\nentire whale whole.
284	284
285	285
286	286
Anzu	An evil deity of Mesopotamian\nfolklore with an eagle's body\nand lion's head.\n \nWhile the god Enlil purified himself,\nAnzu stole the Tablet of Destinies\nfrom him in an attempt to become\nthe chief god.
Zhen	A bird in Chinese mythology said to\nhave poison in its feathers because\nit eats poisonous snakes.\n \nDipping a feather into wine will turn\nit into a deadly poison, able to kill\nanyone with a single drop.
Muu Shuwuu	Meaning \''evil bird,\'' it is the ghost\nof a young girl who died without\nknowing love in Buryat folklore.\n \nShe seduces travelers, only to crack\ntheir heads open and suck out their\nbrains with her beak.
Onmoraki	A Japanese monster that takes the\nform of a bird with the face of a man.\nIt produces a sickening chirp and\nspits a wicked flame.\n \nIts true identity is a corpse that hasn't\nhad a proper memorial service, and it\nis said to appear before monks who\nneglect their duties.
Gurulu	A demon that takes the shape of a\ngiant bird in Sri Lankan mythology.\n \nAlso known as \''Gurulu Yaksha.\''\nIt is believed to be a derivation\nof Garuda, the spirit bird of Indian\nmythology, which is in ideological\nopposition to its place in Sri Lankan\nmythology, in which it is interpreted\nas a demon.
292	292
293	293
294	294
Cleopatra	More specifically, Cleopatra VII. Her\nname means \''glory of the father\'' in\nGreek.\n \nShe is known as one of the greatest\nbeauties ever to live, having charmed\nmany with her musical voice and\nconversation skills. It is said that\nall of history would have unfolded\ndifferently had even her nose been\nlonger or shorter.
Rangda	A wicked witch and the symbol of evil\nin Balinese Hinduism. When women\nwho used magic held a grudge or\nwent down the path of evil, they\nbecame this dreadful creature.\n \nShe spreads plagues, causes natural\ndisasters, curses people, and even\nuses evil spirits to do her bidding.\nThe holy beast Barong that\nsymbolizes good is her eternal rival.\nEven if defeated, she will come back\nto life, and their battle will have no\nend.
Dakini	Hindu deities of passion and relations.\nThey are Kali's attendants.\n \nThey eat human flesh and gather\nat graveyards and crematories\neach night.\n \nTheir name means \''sky dancer,\''\nand they are said to dance\nthrough the sky with skulls as\nblood-filled cups in their hands.
Atropos	One of the three Moirae Sisters in\nGreek mythology. \n \nShe cuts the life threads of those\nwhose time has come.
Yakshini	Semi-divine beings in Hindu\nmythology.\n \nThough they were once worshiped\nby the Dravidians as goddesses of\nthe harvest, they became interpreted\nas demons with the spread of\nHinduism and the two clashing\nideologies. They are depicted as\nnaked women with voluptuous\nbodies.
Lachesis	One of the three Moirae Sisters in\nGreek mythology. \n \nShe is the apportioner, measuring the\nthread which determines each\nperson's life span.
Clotho	One of the three Moirae Sisters in\nGreek mythology. \n \nShe is the spinner of the threads of\nfate.
Manananggal	A witch whose lore originated\nin the Philippines.\n \nIt masquerades as a beautiful woman\nduring the day but transforms into a\nblood-sucking monster at night. It\nhas the ability to separate its upper\nand lower body, and can sprout bat\nwings from its back to fly in search of\nhumans to suck their blood. It is said\nthat the Manananggal preys on\nunborn fetuses in particular, using its\nproboscis-like tongue to open the\nwombs of pregnant women, wherein\nit will suck the fetus's blood, or\ndevour it outright.
Lamia	Half-woman, half-snake creatures that\nappear in Greek mythology and are\nsaid to reside in Libya.\n \nThey supposedly favor the blood of\nchildren and young men.\n \nOriginally a beautiful Libyan queen\nloved by Zeus, she was killed\nby the goddess Hera, who was\njealous of her children.\nIn her madness, she is said\nto have turned into a monster\nthat attacks and eats people.
Mermaid	Half-woman, half-fish, inhabitant of\nthe ocean. Males are called mermen.\n \nMermaids are regarded as ill omens\nby many fishermen, often foretelling\nsevere storms or poor catches.\nLegend says they use their voices\nto charm men, causing them to\ncrash their ships.
Leanan Sidhe	A beautiful fairy of Irish lore that\nyearns for the love of a human man.\n \nShe drains the life of her lovers in\nreturn for granting them artistic\ninspiration.
306	306
307	307
308	308
309	309
Ongyo-Ki	One of the four oni controlled by\nFujiwara no Chikata, who ruled Iga\nand Ise during the Heian Period.\n \nBy suppressing its aura, thereby\npreventing others from sensing its\npresence, it can effectively ambush\nits enemies. Oni have been said to act\nas liaisons between humans and gods,\nand the Fudoki holds many records of\nsuch exchanges in this region.
Shiki-Ouji	A powerful creature often summoned\nby Japanese sorcerers called\nonmyoji.\n \nThey are used both to hurt and to\nheal, but their true nature is said\nto be very violent.
Sui-Ki	One of the four oni controlled by\nFujiwara no Chikata, it can cause\nfloods with the swing of its arms.\n \nIn the Taiheiki, a brave courtier\nnamed Ki no Tomo-o expelled\nthe oni by sending them an elegantly\nphrased threat in poetic form.
Fuu-Ki	One of the four oni controlled by\nFujiwara no Chikata, it sends\nhurricanes to blow away its enemies.\n \nSome say that Fuu-Ki is the original\nninja.
Kin-Ki	One of the four oni controlled by\nFujiwara no Chikata, its body is so\nhard that no weapons can penetrate\nit.\n \nIt and its comrades fell into hell\nthrough holes that can still be found\nin Mie Prefecture, Japan (the\nmodern-day Iga Province).
Azumi	A water deity of the Azumi, a\nJapanese seafaring tribe. As such,\nit can freely control water.\n \nThe three gods born from Izanagi after\nhe returned from Yomi are said to be\nthe Azumi tribe's ancestors.
Ippon-Datara	A monster with one eye and one leg,\nsaid to live deep in the mountains of\nKumano, Japan.\n \nA single footprint measuring\n30 cm has been sighted in the\nsnowy mountains.
Daemon	A low-ranking class of spirits.\nWhile the name may conjure up\nfamiliar images of \''demons\'' due to\nChristianity's influence, daemons\nwere not strictly associated with good\nor evil and simply thought to be lesser\nsupernatural beings, sometimes\nacting as tutelary spirits that guided\nthe souls of men.\n \nWhat might be considered a demon\ntoday would've been called a\n\''cacodaemon\'' in ancient\nGreece—that is, an evil spirit.\nIn contrast, their benevolent\ncounterparts were known as\n\''agathodaemons.\''
Oni	A common demon in Japanese\nmythology. This terrifying and\npowerful creature is known to raid\nhuman villages for food, riches, and\nwomen.\n \nIt is characterized by red skin,\nhorns on its head, long claws,\nand sharp fangs.
Karasu Tengu	A member of the tengu race.\n \nThey do not have the long nose that\nusually represents the tengu, but, as\nthe name \''karasu\'' (crow) suggests,\nthey are said to have a sharp beak\nsimilar to that of a crow. They harbor\nan evil nature, seeking to corrupt\npeople by haunting them.
320	320
321	321
Hecatoncheires	Giants born from Uranus and Gaia in\nGreek mythology. The name means\n\''those with a hundred arms.\''\n \nDuring the war of the Titans, Zeus\nfreed them from the underworld to\nhelp him obtain victory.
Loa	A group of divinities worshiped in\nvoodoo religion.\n \nOf the many hidden entities\nmentioned in religious doctrines,\nthe ones that influence human\nactivities in the earthly realm\nare known by this name. It is said\nthat those aligned with shadow also\npossess powerful dark magic.
Rakshasa	Evil spirits that battle the gods in\nHindu lore. They also attack humans.\n \nTheir hideous appearance symbolizes\ntheir evil nature, but they can also\nchange shape to fool humans.\nThey are also said to feed on\nhuman corpses to encourage\nslander and distrust.
Turdak	An Indian deity that serves Yama, the\ngod of death. \n \nWhen Yama judges a dead soul to be\nguilty, Turdak acts as the executioner\nand drags that soul to hell.
Macabre	An evil spirit appearing in medieval\noratorios as the grim reaper. \n \nIt is truly Death itself, with the power\nto lead humans to their demise in an\ninstant. It is depicted as a skeleton\nwith a black cloak and a sickle to reap\nhuman souls in a single stroke. True\nto its name, it dances the feared\nDance of Death, a reminder that all\nworldly things must someday meet\ntheir end.
Gremlin	A mischievous sprite that enjoys\nwreaking havoc on machines and\ntools. It's said that during World War\nII, Gremlins often were found when\nexamining plane failures.\n \nThough rather troublesome\ncreatures, Gremlins have been\nknown to be quite useful at times\nand are even said to have helped\nBenjamin Franklin with his famous\nkite experiment.
328	328
329	329
Kaya-no-Hime	A goddess of grasses in Japanese\nmythology.\n \nThe name \''Kaya\'' refers to the grass\nthat was used to build traditional\ngrass-roof houses, highlighting its\nimportance to the people of ancient\nJapan.
Tsuchigumo	Monsters said to come from the\nbastardization of certain clans of\nJapan. The word carries the literal\nmeaning of \''dirt spider.\''\n \nThose who did not pledge allegiance\nto the Imperial Court were called this\nderogatory term because of their\nshort stature and spindly limbs.\nAs time passed, people may have\nmisinterpreted the name for a literal\nmeaning and made them into spiders,\nor perhaps the manifestations of\ngrudges of those who were\npersecuted by the Imperial Court.
Narcissus	A young man of Greek lore.\nHe rejected the nymph Echo, who\nfaded to a whisper out of despair.\n \nCursed by Nemesis, he fell in love\nwith his own reflection and wasted\naway, becoming the flower that now\nbears his name.
Hua Po	Tree spirits in Chinese mythology that\nare born when three or more people\nhang themselves from the same tree.\n \nThey take the form of a beautiful\nwoman in white clothing, however\nthey are much smaller in size than a\nhuman. They cannot talk, though they\ncan chirp like birds.
Koropokkur	Small human-like creatures that have\nkind, calm personalities.\n \nOnce coexisting with the Ainu people\nof Japan, there was a falling out at\nsome point, and they disappeared.
Sudama	Earth spirits in Japanese mythology.\nThey are born from ancient trees\nand boulders.\n \nThey are not evil but will transform\ninto humans or monsters to warn\npeople not to infiltrate their\nmountains.
Kodama	In Japanese mythology, they are the\nspirits of plants. They are born from\ntrees that live 100 years.\n \nIt was once thought that the echoes\nheard in valleys were actually from\nKodama replying.
